{
  "project": "/repo",
  "schema_version": 61,
  "admission": "enabled",
  "hold_note": null,
  "workers": 1,
  "active_routes": {
    "implementer": {
      "command": null
    },
    "reviewer": {
      "command": null
    },
    "adjudicator": {
      "command": null
    },
    "writer": {
      "command": null
    },
    "trimmer": {
      "command": null
    },
    "implementer_profiles.sonnet": {
      "command": "claude"
    }
  },
  "route_labels": {
    "implementer": "claude opus",
    "reviewer": "codex gpt-6-astra",
    "reviewer_fallback": null,
    "adjudicator": "codex gpt-6-astra",
    "writer": "claude opus",
    "trimmer": "claude opus",
    "implementer_fallback": null,
    "adjudicator_fallback": null,
    "trimmer_fallback": null,
    "implementer_profiles": {
      "sonnet": "claude sonnet"
    }
  },
  "workers_on_previous_build": 0,
  "host": "writer",
  "now": 1750000000000,
  "toil": {
    "24h": {
      "interventions": 2,
      "merged": 0,
      "per_merge": null,
      "by_action": {
        "approve": 1,
        "steer": 1
      },
      "by_actor": {
        "maintainer": 0,
        "operator": 2,
        "supervisor": 0,
        "unknown": 0
      }
    },
    "7d": {
      "interventions": 2,
      "merged": 0,
      "per_merge": null,
      "by_action": {
        "approve": 1,
        "steer": 1
      },
      "by_actor": {
        "maintainer": 0,
        "operator": 2,
        "supervisor": 0,
        "unknown": 0
      }
    }
  },
  "daemon": {
    "started_ms": 1750000000000,
    "pid": 1
  },
  "supervisor": {
    "state": "live",
    "pid": 1,
    "heartbeat_age_ms": 5000,
    "host": "writer"
  },
  "thresholds": {
    "heartbeat_stale_ms": 300000,
    "strikes": 2,
    "run_cap": 3.0
  },
  "actions": false,
  "config_edit": false,
  "runs": [
    {
      "id": 1,
      "ticket": "KO-7",
      "ticket_url": null,
      "title": "ticket 7",
      "phase": "working",
      "started_ms": 1750000000000,
      "heartbeat_age_ms": 30000,
      "elapsed_ms": 120000,
      "working_ms": 0,
      "work_started_ms": null,
      "agent_ms": 0,
      "verify_ms": 0,
      "run_count": 1,
      "verify_started_ms": null,
      "time_box_ms": 1500000,
      "round": 1,
      "max_rounds": 2,
      "strikes": 0,
      "host": "writer",
      "stop_requested": null,
      "stop_action": null,
      "step": null,
      "pr_url": null,
      "pr": null,
      "woke_ms": null
    },
    {
      "id": 1,
      "ticket": "KO-8",
      "ticket_url": null,
      "title": "Unestimated ticket",
      "phase": "claimed",
      "started_ms": 1750000000000,
      "heartbeat_age_ms": 0,
      "elapsed_ms": 0,
      "working_ms": null,
      "work_started_ms": null,
      "agent_ms": null,
      "verify_ms": null,
      "run_count": 1,
      "verify_started_ms": null,
      "time_box_ms": null,
      "round": 0,
      "max_rounds": 2,
      "strikes": 0,
      "host": null,
      "stop_requested": null,
      "stop_action": null,
      "step": null,
      "pr_url": null,
      "pr": null,
      "woke_ms": null
    }
  ],
  "queued": [
    {
      "ticket": "KO-9",
      "ticket_url": null,
      "title": "Approved ticket",
      "reason": "approved for merge; the next claim resumes the candidate at the merge gate",
      "pr_url": "https://github.com/example/repo/pull/9",
      "waiting_ms": 60000
    }
  ],
  "witnesses": null,
  "route_probes": {
    "implementer": {
      "primary": null,
      "fallback": null
    },
    "reviewer": {
      "primary": null,
      "fallback": null
    },
    "adjudicator": {
      "primary": null,
      "fallback": null
    },
    "writer": {
      "primary": null,
      "fallback": null
    },
    "trimmer": {
      "primary": null,
      "fallback": null
    },
    "implementer_profiles.sonnet": {
      "primary": null,
      "fallback": null
    }
  }
}
